{"admitted":true,"apiVersion":"herdforge.dev/v1alpha1","blocking":false,"callbackDestination":"herdforge-coordinator","correlation":{"callbackSequence":7,"candidateSha":"3333333333333333333333333333333333333333","phaseId":"phase-SPE-566-implement","runId":"run-SPE-566-1","scopeId":"scope-SPE-566","task":"SPE-566"},"idempotencyKey":"idem-SPE-558-1","job":{"candidateSha":"3333333333333333333333333333333333333333","phaseId":"phase-SPE-566-implement","runId":"run-SPE-566-1","scopeId":"scope-SPE-566"},"kind":"TrustedJobSubmissionReceipt","model":"gpt-5.6-luna","provider":"openai","scopeDigest":"sha256:4ede6bb11f103f38c8565c487d136b7b240e82bd1484f8e5f0efda6f246f758f","status":"admitted","submissionDigest":"sha256:1afd81140222babfc494ca6e71b557b3056372e60a91353eaa37337ea8d0f319","violations":[],"workspace":{"baseSha":"1111111111111111111111111111111111111111","headSha":"2222222222222222222222222222222222222222","path":".worktrees/SPE-566-agentscope-contract","repository":"github.com/Kampe/Herdforge","repositoryRoot":".","worktree":"worktree-SPE-566"}}
